{
  "id": "AC549fXwgQm8huC3LEcNJw",
  "version": "1.0.0",
  "package": {
    "client": {
      "deploy": "client/dist"
    },
    "server": {
      "launch": "server/dist/main.js",
      "deploy": [
        "server/dist"
      ],
      "nodeModules": [
        "node_modules"
      ]
    }
  },
  "permissions": {}
}
