{
  "id": "xxxxxxxxxxxxxxxxxxxxxx",
  "version": "1.0.0",
  "package": {
    "server": {
      "launch": "dist/main.js",
      "deploy": [
          "dist"
      ],
      "nodeModules": [
          "node_modules"
      ]
    }
  },
  "permissions": {
    "channel": {
      "createMessage": true,
      "createMessageMention": true,
      "createMessageReaction": true,
      "managePinnedMessages": true,
      "deleteMessageOther": true
    }
  }
}
