{
  "id": "AC5eDkNLjQmLbs9oh6g9zg",
  "version": "1.0.0",
  "package": {
    "server": {
      "launch": "dist/main.js",
      "deploy": [
        "dist"
      ],
      "nodeModules": [
        "node_modules"
      ]
    }
  },
  "permissions": {
    "channel": {
      "createMessage": true
    }
  }
}
