{
  "id": "xxxxxxxxxxxxxxxxxxxxxx",
  "version": "1.0.0",
  "package": {
    "server": {
      "launch": "server/dist/main.js",
      "deploy": [
        "server/dist",
        "networking/gen/server"
      ],
      "nodeModules": [
        "node_modules"
      ]
    }
  },
  "permissions": {
    "channel": {
      "createMessage": true
    }
  }
}
