{
  "id": "AC1M7Pf8hwmJIwRauk7NUQ",
  "version": "1.0.0",
  "package": {
    "server": {
      "launch": "dist/main.js",
      "deploy": [
        "dist"
      ],
      "nodeModules": [
        "node_modules"
      ]
    }
  },
  "settings": {
    "groups": [
      {
        "key": "general",
        "title": "General",
        "items": [
          {
            "key": "vipMembers",
            "title": "VIP Members",
            "description": "Users and roles with VIP access",
            "required": false,
            "roleOrMember": {
              "selectBehavior": "roleMultiAndUserMulti"
            }
          }
        ]
      }
    ]
  },
  "permissions": {
    "channel": {
      "createMessage": true
    }
  }
}
